{
  "client": "demo-brand",
  "source": "figma",
  "figma_url": "https://www.figma.com/design/EXAMPLE/Demo-Brand-Brand?node-id=42-15",
  "extracted_at": "2026-06-21",
  "version": "1.0.0",

  "colors": {
    "primary": "#2B2B2B",
    "secondary": "#5C5C5C",
    "accent": "#C8A97E",
    "background": "#F9F7F4",
    "surface": "#FFFFFF",
    "text": "#1A1A1A",
    "text-sub": "#666666",
    "text-inverse": "#FFFFFF",
    "border": "#E5E5E5",
    "success": "#10B981",
    "warning": "#F59E0B",
    "error": "#EF4444",
    "info": "#3B82F6"
  },

  "typography": {
    "font-family": "Pretendard",
    "heading": {
      "weight": 700,
      "size": "32px",
      "line-height": 1.3,
      "letter-spacing": "-0.02em"
    },
    "subhead": {
      "weight": 600,
      "size": "20px",
      "line-height": 1.4,
      "letter-spacing": "-0.01em"
    },
    "body": {
      "weight": 400,
      "size": "15px",
      "line-height": 1.6,
      "letter-spacing": "0"
    },
    "caption": {
      "weight": 400,
      "size": "13px",
      "line-height": 1.5
    },
    "button": {
      "weight": 600,
      "size": "14px",
      "line-height": 1.2
    }
  },

  "spacing": {
    "xs": "4px",
    "sm": "8px",
    "md": "16px",
    "lg": "24px",
    "xl": "40px",
    "2xl": "64px",
    "3xl": "96px"
  },

  "radius": {
    "none": "0px",
    "sm": "4px",
    "md": "8px",
    "lg": "16px",
    "xl": "24px",
    "full": "9999px"
  },

  "shadow": {
    "sm": "0 1px 2px rgba(0, 0, 0, 0.05)",
    "md": "0 4px 8px rgba(0, 0, 0, 0.08)",
    "lg": "0 8px 24px rgba(0, 0, 0, 0.12)",
    "xl": "0 16px 40px rgba(0, 0, 0, 0.16)"
  },

  "breakpoints": {
    "mobile": "375px",
    "tablet": "768px",
    "desktop": "1280px",
    "wide": "1440px"
  },

  "page_types": ["hero-main", "plp-full", "pdp-full", "narrow"],
  "tone": "럭셔리 미니멀 — 절제된 톤, 여백 강조",
  "nk_prefix": "nk-",
  "notes": "원목·차분한 베이지 톤 브랜드. 본문은 회색 톤으로 무게감, 강조는 베이지 골드(#C8A97E)로만 사용."
}
